{
  "$schema": "./visual-manifest.schema.json",
  "schemaVersion": 1,
  "generatedAt": "2026-10-23",
  "sourceNote": "Seven semantic categories, reviewed local ingestion on 2026-10-23; original bytes and existing visual IDs preserved. Cloud upload and activation are pending.",
  "themes": [
    "light",
    "dark",
    "dawn",
    "forest",
    "lavender",
    "minimal"
  ],
  "visuals": [
    {
      "id": "night_lake_reading_01",
      "category": "rest",
      "description": "夜空下的山湖与新月，前景是翻开的书和陶杯；安静私密，适合深夜阅读场景。",
      "tags": [
        "夜",
        "湖",
        "阅读",
        "独处",
        "新月",
        "安静",
        "rest",
        "lake",
        "nature",
        "quiet",
        "night",
        "book",
        "moon"
      ],
      "mood": [
        "quiet",
        "intimate",
        "nocturnal"
      ],
      "intendedPage": [
        "discover",
        "plan",
        "shared",
        "explore"
      ],
      "visualRole": [
        "hero",
        "page-background",
        "card-thumbnail"
      ],
      "themeCompatibility": [
        "dark"
      ],
      "source": "chatgpt-generated",
      "originalPath": "assets/visual-library/originals/rest/rest_night_lake_reading_01.png",
      "sourceSha256": "d6666fd470f9dc83f43cdeb9d59a0335d3282a132dca6bc6f8d2d6a28205da11",
      "sourceBytes": 1870047,
      "dimensions": {
        "width": 1536,
        "height": 1024,
        "aspectRatio": 1.5
      },
      "status": "deployed",
      "deploy": true,
      "sourceGroup": "night-lake-reading",
      "runtimeVariants": {
        "dark": "/static/bloom/night-reading.jpg"
      },
      "heroVariants": {
        "dark": "/static/bloom/night-scene.jpg"
      }
    },
    {
      "id": "dusk_lake_reading_01",
      "category": "rest",
      "description": "琥珀色黄昏的湖面与山影，前景有阅读椅、书和杯子；温暖、收束。",
      "tags": [
        "黄昏",
        "湖",
        "阅读",
        "温暖",
        "收束",
        "rest",
        "lake",
        "nature",
        "quiet",
        "night",
        "book",
        "dusk"
      ],
      "mood": [
        "warm",
        "still",
        "reflective"
      ],
      "intendedPage": [
        "discover",
        "plan",
        "shared"
      ],
      "visualRole": [
        "hero",
        "page-background",
        "card-thumbnail"
      ],
      "themeCompatibility": [
        "dawn"
      ],
      "source": "chatgpt-generated",
      "originalPath": "assets/visual-library/originals/rest/rest_dusk_lake_reading_01.png",
      "sourceSha256": "7b69a44be73c3ca28af8f0989978401f2d3950cf2aa695161cedefb4a0a7f66f",
      "sourceBytes": 1813184,
      "dimensions": {
        "width": 1536,
        "height": 1024,
        "aspectRatio": 1.5
      },
      "status": "deployed",
      "deploy": true,
      "sourceGroup": "dusk-lake",
      "runtimeVariants": {
        "dawn": "/static/bloom/dusk-reading.jpg"
      },
      "heroVariants": {
        "dawn": "/static/bloom/dusk-scene.jpg"
      }
    },
    {
      "id": "lavender_lake_reading_01",
      "category": "growth",
      "description": "灰紫薰衣草花丛与湖山，前景是书和杯子；柔和、带生长的气息。",
      "tags": [
        "薰衣草",
        "湖",
        "阅读",
        "柔和",
        "生长",
        "growth",
        "new-beginning",
        "hope",
        "nature",
        "lake",
        "book",
        "lavender"
      ],
      "mood": [
        "gentle",
        "hopeful",
        "airy"
      ],
      "intendedPage": [
        "discover",
        "plan",
        "shared"
      ],
      "visualRole": [
        "hero",
        "page-background",
        "card-thumbnail"
      ],
      "themeCompatibility": [
        "lavender"
      ],
      "source": "chatgpt-generated",
      "originalPath": "assets/visual-library/originals/growth/growth_lavender_lake_reading_01.png",
      "sourceSha256": "e5f6b67acdb9a8ec1cc61d697572d894a41b70e78240426f34bd1799a49ec97e",
      "sourceBytes": 2013845,
      "dimensions": {
        "width": 1536,
        "height": 1024,
        "aspectRatio": 1.5
      },
      "status": "deployed",
      "deploy": true,
      "sourceGroup": "lavender-lake",
      "runtimeVariants": {
        "lavender": "/static/bloom/lavender-reading.jpg"
      },
      "heroVariants": {
        "lavender": "/static/bloom/lavender-scene.jpg"
      }
    },
    {
      "id": "ivory_window_reading_01",
      "category": "reflection",
      "description": "象牙色窗边阅读角落，窗外是明亮湖山与书；克制、留白。",
      "tags": [
        "窗边",
        "阅读",
        "留白",
        "明亮",
        "极简",
        "reflection",
        "reading",
        "pause",
        "decision",
        "daily-life",
        "window",
        "book",
        "minimal"
      ],
      "mood": [
        "bright",
        "minimal",
        "calm"
      ],
      "intendedPage": [
        "discover",
        "plan",
        "shared"
      ],
      "visualRole": [
        "hero",
        "page-background",
        "card-thumbnail"
      ],
      "themeCompatibility": [
        "minimal"
      ],
      "source": "chatgpt-generated",
      "originalPath": "assets/visual-library/originals/reflection/reflection_ivory_window_reading_01.png",
      "sourceSha256": "d4fa1b08f6260a14c489752123cd1ebb050283f5ea7817b35cecb8345769fd50",
      "sourceBytes": 2087996,
      "dimensions": {
        "width": 1536,
        "height": 1024,
        "aspectRatio": 1.5
      },
      "status": "deployed",
      "deploy": true,
      "sourceGroup": "ivory-window",
      "runtimeVariants": {
        "minimal": "/static/bloom/minimal-reading.jpg"
      },
      "heroVariants": {
        "minimal": "/static/bloom/minimal-scene.jpg"
      }
    },
    {
      "id": "misty_lake_meadow_01",
      "category": "rest",
      "description": "晨雾湖面、草甸与远山，柔和晨光；安静、清新。",
      "tags": [
        "晨雾",
        "湖",
        "草甸",
        "远山",
        "清新",
        "rest",
        "lake",
        "nature",
        "quiet",
        "night",
        "meadow",
        "mist"
      ],
      "mood": [
        "fresh",
        "misty",
        "hopeful"
      ],
      "intendedPage": [
        "discover",
        "shared"
      ],
      "visualRole": [
        "hero"
      ],
      "themeCompatibility": [
        "light",
        "dawn"
      ],
      "source": "chatgpt-generated",
      "originalPath": "assets/visual-library/originals/rest/rest_misty_lake_meadow_01.png",
      "sourceSha256": "0da5afeae7ae861ce53567a24e283b8fcc3e478bfacd3b65d68f0b86caf3e0fb",
      "sourceBytes": 1982004,
      "dimensions": {
        "width": 1448,
        "height": 1086,
        "aspectRatio": 1.3333
      },
      "status": "deployed",
      "deploy": true,
      "sourceGroup": "lake-open",
      "runtimeVariants": {},
      "heroVariants": {
        "light": "/static/bloom/mist-lake.jpg"
      }
    },
    {
      "id": "forest_sunbeam_path_01",
      "category": "direction",
      "description": "林间小径穿过树影和白色野花，阳光从树冠落下；方向感、希望。",
      "tags": [
        "森林",
        "小径",
        "阳光",
        "方向",
        "希望",
        "direction",
        "path",
        "choice",
        "possibility",
        "exploration",
        "forest",
        "sunbeam"
      ],
      "mood": [
        "hopeful",
        "grounded",
        "open"
      ],
      "intendedPage": [
        "discover",
        "explore",
        "shared"
      ],
      "visualRole": [
        "hero",
        "card-thumbnail"
      ],
      "themeCompatibility": [
        "forest",
        "light"
      ],
      "source": "chatgpt-generated",
      "originalPath": "assets/visual-library/originals/direction/direction_forest_sunbeam_path_01.png",
      "sourceSha256": "4bcc087f8397a4585e5081cac9bae8e87e4d68d3727d898d2dc4719d06eb4cd5",
      "sourceBytes": 2705814,
      "dimensions": {
        "width": 1122,
        "height": 1402,
        "aspectRatio": 0.8003
      },
      "status": "deployed",
      "deploy": true,
      "sourceGroup": "forest-path",
      "runtimeVariants": {
        "light": "/static/bloom/forest-path.jpg",
        "forest": "/static/bloom/forest-path.jpg"
      },
      "heroVariants": {
        "forest": "/static/bloom/forest-hero.jpg"
      }
    },
    {
      "id": "sunlit_desk_01",
      "category": "reflection",
      "description": "阳光照进窗边书桌，桌面有书、杯子和植物；专注、日常。",
      "tags": [
        "窗边",
        "书桌",
        "阳光",
        "专注",
        "日常",
        "reflection",
        "reading",
        "pause",
        "decision",
        "daily-life",
        "desk",
        "book",
        "sunlight"
      ],
      "mood": [
        "focused",
        "calm",
        "everyday"
      ],
      "intendedPage": [
        "discover",
        "plan",
        "explore",
        "shared"
      ],
      "visualRole": [
        "hero",
        "card-thumbnail"
      ],
      "themeCompatibility": [
        "forest",
        "light",
        "minimal"
      ],
      "source": "chatgpt-generated",
      "originalPath": "assets/visual-library/originals/reflection/reflection_sunlit_desk_01.png",
      "sourceSha256": "a96654ac9b74f2ce851f47bacdbec8b2bb06f0e9d5057eae7f14dde04113266e",
      "sourceBytes": 2163608,
      "dimensions": {
        "width": 1122,
        "height": 1402,
        "aspectRatio": 0.8003
      },
      "status": "deployed",
      "deploy": true,
      "sourceGroup": "reading-desk",
      "runtimeVariants": {
        "light": "/static/bloom/reading-corner.jpg",
        "forest": "/static/bloom/reading-corner.jpg"
      },
      "heroVariants": {
        "forest": "/static/bloom/forest-reading.jpg"
      }
    },
    {
      "id": "lakeside_sunset_01",
      "category": "reflection",
      "description": "一位背对镜头的人坐在日落湖边；独处、回望，不展示正脸。",
      "tags": [
        "湖",
        "日落",
        "独处",
        "回望",
        "人物背影",
        "reflection",
        "reading",
        "pause",
        "decision",
        "daily-life",
        "lake",
        "sunset",
        "solitude"
      ],
      "mood": [
        "solitary",
        "warm",
        "reflective"
      ],
      "intendedPage": [